{
  "formatVersion": 1,
  "protocol": "biunivers.static-app/1",
  "appId": "io.github.echo983.biunivers-notepad",
  "version": "0.1.1",
  "name": "Biunivers Notepad",
  "description": "A minimal text editor used to validate Biunivers Host API v1.",
  "license": "MIT",
  "icon": "icon.svg",
  "window": {
    "defaultWidth": 760,
    "defaultHeight": 560,
    "minWidth": 420,
    "minHeight": 320,
    "desktop": true,
    "pinned": false
  },
  "configuration": []
}
